,subreddit,selftext,title,created_utc
258,financialindependence,"My wife and I are freshly 40 years old with a little one on the way.

We currently have $1.5 million saved in retirement accounts (a lower number than last year due to the abysmal performance of the markets). We have about two years of living expenses on hand; house paid off. 

My wife’s salary is around $20,000 per year and mine is around $280k. Mine is from running a service oriented business. 

Building my business to that point has broken me; mentally, emotionally, and spiritually. I can’t sleep at night; cortisol pumps through my veins and stress dominates every aspect of my life. I can’t even enjoy my wife’s pregnancy. In my wife’s words, I have become a shell of a person. 

Ideally, we’ve discussed coast-firing, starting today and until age 49, at which point, full fire with 90-100k per year. 

I appreciate all suggestions but I must share:

I’m not able to sell my business; it relies on me and me alone. When I’m done, it’s done. This is because of relationships with my clients. Imagine a barber with clients and those clients only want to be cut by that specific barber. Trying to sell my business would be like a barber trying to sell his customer list. 

I’m not going to start exercising and eating better to manage stress; I’m a former athlete and former model. My fitness and nutrition leave nothing to be desired with the exception of the damage from constant stress. 

I’ve already tried therapy at least 15 times. Honestly, I find Reddit forums more helpful. Real people sharing real solutions and experiences. 

Work and maintaining clients is so stressful and is the reason I’ve gotten to this point. That’s the catch 22: I have a nice amount of money saved because of the grind but I don’t even feel like a man or a quality husband anymore because of the grind. What kind of father am I going to be?

My wife and I have discussed my closing the business and getting a lower stress job to coast. The downside of this is that I would feel like I’m leaving too much money on the table by walking away from my current business. 

The only true answer that I see is to continue with my current job but let clients go, work less, and just capitalize on the time that I do spend at work. This is the challenge; just thinking about making less gives me anxiety. I want to throw up. I tried so hard to build my business and the thought of moving in reverse physically ills me. 

I spent virtually the last 15 years building my business. Years of 7 day work weeks, years of little to no sleep, years of stress GRIND STRESS SAVE MONEY STRESS GRIND STRESS SAVE MONEY. I’ve had to sleep on the floors of my business before, give up time with my family, ruin relationships with exes, etc. 

I feel like a zombie who has been walking through a nightmare for a decade. I just don’t know how to let go, cut down, and be ok working a much shorter work week at a much lower salary. If I did so, I feel like I would have the same problems as now but I would just be making less. For example, if I’m making $280k and living with the constant stress and anxiety of trying to maintain that salary or make more money next year, if I cut down to $150k, won’t I be living with the same stress and anxiety of trying to maintain $150k?

I come from a poor family and a scarcity mindset; I never thought I would be able to make money doing anything. For over a decade, I’ve been afraid my business is going to implode and I’m going to lose everything. Now, I just want to hit fire and never go back to it; I want to be a viable husband to my wife and an involved father to my son. I want to live life. 

Has anyone had a similar experience or can offer a shift in perspective? I posted this in fire because it’s all involving fire. I need a plan to coast fire or fire or something to get out. I’m so convinced that if I drop in salary that I’m going to lose the whole business. I’m at the lowest point I’ve ever been; can’t eat, sleep, or even feign a smile. 

Thanks in advance. 

Some things I’ve realized after reading through many responses in fire abs coast fire subreddits. 

I haven’t built a business; I’m simply self employed. 

I value my worth based on the amount of money I make. Saving large amounts of money makes me feel secure. 

The idea of making less sends physical tremors up and down my body. I worked so hard to build up to this point; it makes me physically ill just thinking about it.",High salary job in pursuit of fire destroyed my soul. Now I have a little one on the way and need advice.,1672750900
259,financialindependence,"With the high probability of a recession incoming (or already here), it would be great to hear stories of folks who exceeded expectations during the last recession in 2008. I was in high school in 2008 and didn't have the liquid capital at the time to take advantage of recession opportunities; but this time I do.

How did you take advantage of the 2008 recession to secure life-changing wealth? And could you repeat the same strategies, or do you need to tweak it for 2023?",How Did You Accelerate Your Wealth During 2008? Can You Do It Again?,1672748949
260,financialindependence," 

Hello,

So I found out about the Backdoor Roth IRA late and just made an account with fidelity.

I contributed $6000 (post tax) to traditional IRA with plan to convert to Roth IRA before 12/31/22 ended but it seems like the $6000 hasn't settled and I'm unable to convert it yet. I'll be converting it as soon as I can in 2022. I have no other IRAs or anything. Just have 403b that I started earlier this year (2022).

1. How do I go about it when it comes to reporting taxes?
2. Do I get taxed/pro-rata? on this $6000?

Thank you for helping out a dummy.

Sorry if this was asked before. I wasn't able to find a post with the same situation.",Backdoor Roth IRA conversion after the year mistake...,1672748497
261,financialindependence,"Hello everybody!

&amp;#x200B;

I’m posting here because I need advice on how to become financially independent. I am hoping to get some suggestions based on my current situation.

&amp;#x200B;

I’m a single mother. My son is only 3 y.o. So, I have a full-time job and a part-time freelance job. I’m working really hard so we can have a decent life. I’m also trying to be a good mother, but I guess I've failed at this job. The father of my child left us when my baby was born. Maybe it happened after 2-3 months of happy parenthood.

&amp;#x200B;

You can’t even imagine how tired I am. I don’t even remember when I had a proper day off from all my duties and dedicated some time to myself. That’s why my biggest dream is to reach financial independence, retire a bit earlier, and have some time for myself.

&amp;#x200B;

But with all my taxes, it seems impossible to put something in the savings account. Well, I try to put 10% of my paycheque in savings. But I can barely make the ends meet. I can’t afford so many things. If this is adult life, I don’t wanna it at all.

&amp;#x200B;

Besides, now the tax office takes most of my income. It’s unfair. Aren’t there any benefits for single mothers like me?

&amp;#x200B;

Luckily, things seem to be a bit better. I’ve recently run into my friend who works as an accountant. I shared my story with her, and she said I shouldn’t pay so much in taxes. She said it seemed like my employer didn’t specify some of my working shifts. He didn’t put that I sometimes work hours to make some extra cash. Well, she was in a rush and couldn’t explain it in more detail. That’s why I’ve decided to post here.

&amp;#x200B;

Well, I’ve tried surfing the web and finding something useful. So, I found an online paystubs generator. But it seems a bit complicated to fill in all the info there. Besides, if I put the money I make as a freelancer, does it affect my taxes in a positive for my way?

&amp;#x200B;

Anyway, thanks for reading my rant here. I would appreciate any advice if you know how to help me.",The tax office basically takes all my money. Is it even possible to reach financial independence with all these taxes?,1672748163
262,financialindependence,"Please  use this thread to have discussions which you don't feel warrant a new  post to the sub. While the Rules for posting questions on the basics of  personal finance/investing topics are relaxed a little bit here, the  rules against memes/spam/self-promotion/excessive rudeness/politics  still apply!

Have a look at the [FAQ](https://www.reddit.com/r/financialindependence/wiki/faq) for this subreddit before posting to see if your question is frequently asked. 

Since this post does tend to get busy, consider sorting the comments  by ""new"" (instead of ""best"" or ""top"") to see the newest posts.","Daily FI discussion thread - Tuesday, January 03, 2023",1672740129
263,financialindependence,"I have the finances to be able to max my 401k every year. 

I make $56,000 annually but have no expenses except $50 a month due to living with family. 

If I were to max my 401k, I would have to up my contributions to 32% to achieve $20,500 at the end after their 5% match. 

Aside from my 5% 401k contribution, I currently invest $600/year to crypto, $1,200/year to growth stocks, $8400 to dividend investing, and $6500 to Roth IRA. All in all, I invest $19,500 and save around $36,500. 

I plan to start business’s soon and also invest in a endeavor that will hopefully yield me 50%+ returns annually. I have so many ideas to put money towards but I am not sure if I should contribute 32% of my income to maxing my 401k? Is it worth it? 

I could lower my $8400 in dividend investing but as I have seen, investing in it now and watching it compound year after year is far more beneficial than 401k’s possible growth. (Having more years for it to snowball)

TLDR: I invest $19,500/year and save $36,500. If i max my 401k it will take 32% of income and I would only save $18,837. Are 401k’s worth it anymore after the match or should I pursue my side endeavors that may workout and give me good wealth?",Are 401k’s worth it after match?,1672727729
264,financialindependence,"Sankey: [https://i.redd.it/iw034wb1cr9a1.png](https://i.redd.it/iw034wb1cr9a1.png)

I've been working in tech for about 6 years. In 2022, I quit my job in late September after finding another job (unrelated to the tech layoffs this year). I thought it would be nice to take an extended vacation and set my start date for 2023.

My cash-flow and investment strategy is entirely hands-off. My checking account is configured to invest any amount above $4000 into my brokerage account, and refill up to $3750 via a margin loan when it goes beneath that amount. I don't have an emergency fund — I subscribe to [ERN's thoughts on keeping everything invested](https://earlyretirementnow.com/2016/05/05/emergency-fund/). So that means I was going to have to live off of $4k + margin for three months. It's interesting to consider because I would have had the same financial scenario had I been laid off.

# Finances

In 2021, I spent $47k (comparable to previous years, trending slightly upwards), but in 2022, I spent a staggering $95k. This was due to a lot of larger purchases: $20k car (bought in cash); $8k medical bill; $7k on vacation; $6k on wedding deposits (expecting to run up to $30k total over this year).

For discretionary expenses from 2021 to 2022:

* Eating out: $4.3k → $5.1k
* Leisure: $3.7k → $2.9k
* Vacation: $3.2k → $7.7k
* Gifts: $3.1k → $3.6k
* Dates: $2.3k → $3.5k
* Productivity: $0.5k → $1.8k

I don't feel bad about spending more on dates, gifts, or productivity. Eating out and leisure together total around the same amount. I incurred &gt;2x more vacation costs in 2022; probably a combination of relaxed COVID restrictions and attributing one 2023 vacation to 2022 costs.

I incurred \~$20k of margin debt in Q4 2022... and I feel fine! The margin is drawn against a \~$600k account. Recent interest rate increases mean that I'm paying more in interest for that margin, but it's a small enough amount (in relative terms) that I don't feel the need to sell stock to pay it down. To be honest, if I were laid off, I would be comfortable spending several more months without income in order to find a good job, rather than just the first one available. What a luxury!

I think the lesson here is that I need to adjust my expected spending rate in retirement higher to accommodate for larger expenses which I historically haven't had a lot of. Living off of margin, without an emergency fund, hasn't presented a problem so far.

# Sabbatical

So I get to take a sabbatical and go on test-FIRE for three months! My top goal was to reestablish to a routine gym schedule and go 100% of days when not traveling. I used a habit tracker and I've gone 80% of days in total, which I consider a success overall. I've built a significant amount of strength since reestablishing a schedule.

My secondary goals were:

* Play my favorite video game competitively. I went to in-person tournaments and improved my skill level in some areas, but honestly, I'm performing about as well in Jan 2023 as in Jan 2022. I think I need to get a coach, analyze my games more, and establish a better technical practice routine.
* Arrange music. I did very little of this, to be honest. I still feel very much limited by my instrumental performance ability, not my arrangement ability. However, my performance ability has significantly increased over 2022, and I think especially during my sabbatical period, so I don't think I need a change of strategy yet.
* Learn a new language. Given that I wasn't really immersing myself, I didn't expect to have a lot of success, but I fun doing vocabulary practice and puzzling out the translations of memes.
* Do more open-source software development. I was productive and even accumulated my first GitHub sponsors.
* Write more blog posts. I wrote 5 total in 2022, of which 4 were during the sabbatical period. I got 2.7k views on my most popular post among those.
* Spend more time with friends and family. Well, I certainly wanted to spend more time with them, but they were still all working their jobs, so they couldn't just skive off whenever they wanted. So I planned a few events ahead of time for us (and was able to drive us all there, thanks to the purchase of a car), and visited some of them for lunch/dinner during/after their workdays.

It's clear that I have plenty to do to occupy myself without a job. I haven't really felt the need to quantify or assess my goals formally, as long as I'm doing something from the above in a given day.

Setting a routine for the day is really important to avoid wasting time and regretting it afterwards (wasted time which was enjoyed is not wasted!). I started going to cafes in the mornings with my laptop, just to get out of the house and have a change in scenery. In retirement, I think I'll have to plan to have a space outside the house, whether it's some assortment of cafes, parks, or even a coworking space to hang out in. That will be an important consideration when deciding what neighborhood to live in in retirement.

# Takeaways

* Margin isn't that scary; consider it.
* Plan for more big one-off expenses.
* I don't feel bad spending more on loved ones; and that's an easy type of spending to cut back on, if necessary.
* Sabbaticals are good. Plan things for your friends.
* Prioritize one habit or behavior to establish at a time, and measure that. The rest can be just for fun.","Living on margin in 2022 [HCOL, tech]",1672724297
265,financialindependence,"I know you guys have seen posts like this numerous amounts of times but please help a man out with severe adhd and anxiety. Cutting straight to the point, i dont care for fancy clothes, cars, dining out to fancy restaurants or blasting my money on drinks every weekend, jewerly, and all that jazz. Im a simple man, i love food, lifting, walking, living simple, outdoors, video games, books, family, friends, freedom. I believe im a decently smart dude with a hardworking mindset and am not asking for anything crazy I just want to be comfortable and not worry about money. Didnt go to college and dont have any crazy skills to my resume. What advice do you guys have for a person like me?","I dont necessarily care for being rich or extremely wealthy, I just want to be comfortable and not have to worry about money",1672723633
266,financialindependence,"Graph 2006 to 2015: [https://imgur.com/a/J3H9ff1](https://imgur.com/a/J3H9ff1)

Graph 2016 to 2019: [https://imgur.com/up0xsLd](https://imgur.com/up0xsLd)

Graph 2019 to 2023: [https://imgur.com/75dpK6Q](https://imgur.com/75dpK6Q)

Rather than make a long and detailed write-up of my finances, I thought I'd present the whole story in three graphs. The only large factor not shown is accruing and paying off student loans.

My investments are mostly S&amp;P 500 and Nasdaq-100 ETFs, with some individual tech stocks (breakeven on those after 2022... ouch). I maximize contributions to my Roth 401k and backdoor Roth IRA. 

HCOL, but low rent. Getting more comfortable with spending more on worthwhile QoL improvements.",18 Years of Finance Tracking in 3 Pictures,1672718795
267,financialindependence,[removed],10 things you should do to be financially free before turning 30,1672718499
268,financialindependence," Quick facts: 28 y/o engineer making roughly 72k/yr, salaried, including bonus (consistent 4-5% bonus)

This year I am trying to save &gt;60-70% of my gross income. I am maxing 401k at 22.5k, maxing HSA at 3350+500 employer match, and maxing Roth IRA at 6500 in 2023.

With standard deductions, this puts my federally taxable income at around 32.5k.

Instead of contributing all 22.5k into my employers traditional 401k, should I do more like 11k traditional and 11.5k roth? This would still keep me at the 12% bracket, pay an extra 12% taxes on the 11.5k roth contributions, and get the tax free withdrawals later on?

If it matters, I expect me and my wife to have over 5mil+ between our various retirement accounts by the time we are 60-65.

Thank you",Roth 401k contributions after hitting the 12% tax bracket?,1672716994
269,financialindependence,I'm just getting into the work force and realize that eventually I would rather not have to work for someone else for my livelihood what steps can I take to achieve this ? Any advice helps and thanks,tips to achieve financial independence,1672716780
