,subreddit,selftext,title,created_utc
0,financialindependence,"I know being a single 29M at 100k is not such a great achievement compared to others I have seen on this thread, but everyone goes at there own pace in life. 

When I graduated in 2019 with net worth of -14k I remember feeling very stressed and nervous and told myself I will do everything possible to never feel financially stressed ever again, I am proud to say over the course of 3 work years I have got myself into a somewhat comfortable situation. 

Current financial stats:

3year Average Salary - 90k

Student Loan - 10k 
Retirement - 30k 
Personal Investment (fidelity) - 17k
HSA - 6.5k 
High Yield Savings - 45k
12-month CD - 8k
Crypto - 2.6k
Fixed Living Costs (rent, insurance, phone bills etc..) - ~ 1.6k (no food included) 

I realize I have a lot of cash stashed. I am waiting to see how this year plays out to invest more of it. Regardless I think I feel comfortable leaving 30k in HYS as an emergency fund for 1- year possible unemployment situation. I am in a HCOL area (Cali), I don’t know if i should stash more money away to get ready for a condo purchase that cost around 400k. This goal may take a lot more saving for a few years if I want to keep the 1-year emergency fund. Thoughts?",29M graduated in 2019 and I am 1k away from net worth of 100k!!,1673557670
1,financialindependence,[removed],Investing for the Future Vs Enjoying Life Now,1673553070
2,financialindependence,"The other day I made a [similar post](https://old.reddit.com/r/financialindependence/comments/104qfu9/daily_fi_discussion_thread_friday_january_06_2023/j36ht2s/) in the Daily Thread, but since it's low-mod January I thought I'd make a post about the same topic. Thank you to all who commented in the Daily Thread -- there were some great ideas there. 

I dislike my job and don’t like working as much as everyone else on this sub, but I’m here for different reasons than a lot of other people: there’s a 50% chance I’ll die of (familial) ALS. There are tests, but for now I’ve decided not to get them; I don’t want kids for reasons beyond genetics, so that takes away one of the big motivators to get tested. For me, traditional early retirement is certainly a goal, but my primary goal is being able to walk away from paid work and afford in-home care for the rest of my life the day I get that diagnosis. 

This makes my FIRE planning kind of complicated. I have to plan for both the ""Standard FI"" and ""Terminal RE"" scenarios, but I also know if I get to ""Standard FI"" I'll be extremely lucky. 

What changes to your FIRE plan would you make if you were in my shoes? Is there anything else unique to my situation I should be considering?

Thank you to this amazing community!",Preparing to RE in event of terminal diagnosis,1673547665
3,financialindependence,[removed],I want some tips to start my journey to FI while being a student,1673547294
4,financialindependence,"Longtime lurker here. I don't know if people like these posts, but here is my slow and steady journey to the first 100k that I am celebrating and I hope it help others. 

Numbers are approximate.

**Background**

Late 20s with a spouse, toddler and dog. Another baby is on the way. Got married in early 20s, we both started off with little or negative net worth. Lived in MCOL and LCOL places. 

**Gross Income**

* 2017: 30k Part time work for both of us. Had cheap housing
* 2018: 55k
* 2019: 55k
* 2020: 110k 
* 2021: 90k
* 2022: 95k

**Net Worth**

At end of year

* 2017: 0 ish
* 2018: 2k
* 2019: 4k
* 2020: 55k
* 2021: 75k
* 2022: 97k
* 1/12/23: 100k!

**Current Net Worth Breakdown**

Cash: 12k  
Retirement Accounts: 56k  
Home Equity: 32k (calculated as purchase price - mortgage, not counting any appreciation)

No debts besides mortgage (15 year at 2.5%)

**Random Tidbits**

* I am very thankful for the privileges that I have had. My parents helped pay for college, so I graduated with a bachelor's degree debt free.
* We paid for the last 2 years of my wife's college, taking on some student loans. We paid cash for my masters degree. 
* I am learning to be content and happy with my situation. When I take a step back, I have it made. I have a great job that pays well and I work from home. My spouse is able to stay home with our kid. I have a spacious house and so many other luxuries. 
* We've been a 1 car family since we've been married and saved a lot of money. I was lucky to be able to walk/bike/take transit for my commutes until I switched to remote. We started out with a 6k used car that my spouse had just bought, ran it to the ground and then bought a 7k car that was well maintained from a family member. 
* My spouse and I have fought a lot about finances. They grew up somewhat poor and didn't want to continue living as frugal now that they finally had money. I am naturally very frugal. We tried Mint to track stuff, didn't work well. Then we kind of stopped tracking and just tried to spend from a pot of money after bills and savings were accounted for. I like spreadsheets, my spouse never looked at them and I had a hard time giving up control. A few months ago we switched to a hybrid cash envelope system and using a money book that we track everything in. It's been great. My spouse has gotten much more involved and it feels like we are a team and can both see where the money is going and how much we have left to spend. My advice: keep trying until you find a system that works for you.
* Discovered the FIRE community around 2017 and I soaked up everything I could. I realized the boring middle can hit pretty fast. I have enjoyed all I've learned the last few years and am trying to not focus so much on finances and just live. Invest regularly what you can and simply wait for it to grow.",Journey to the first $100k,1673544231
5,financialindependence,[removed],What are people doing to survive financially?,1673541184
6,financialindependence,[removed],Highest interest savings account? And how hard is it to get one if it's even hard?,1673535834
7,financialindependence,[removed],"33 y/o, 3+ years in the public sector with intermittent contract work - where do I start on the path to RE?",1673532013
8,financialindependence,[removed],"Need advice, should I go all in and aim to FIRE early or not",1673531988
9,financialindependence,[removed],Why is this so hard to figure out?,1673531638
10,financialindependence,[removed],I want to buy an expensive car but don’t want to set myself too far back.,1673530225
11,financialindependence,[removed],Am I thinking straight with this SWR thing?,1673522895
12,financialindependence,"Please  use this thread to have discussions which you don't feel warrant a new  post to the sub. While the Rules for posting questions on the basics of  personal finance/investing topics are relaxed a little bit here, the  rules against memes/spam/self-promotion/excessive rudeness/politics  still apply!

Have a look at the [FAQ](https://www.reddit.com/r/financialindependence/wiki/faq) for this subreddit before posting to see if your question is frequently asked. 

Since this post does tend to get busy, consider sorting the comments  by ""new"" (instead of ""best"" or ""top"") to see the newest posts.","Daily FI discussion thread - Thursday, January 12, 2023",1673517730
13,financialindependence,[removed],God Bless. 🥵🙏🏽🥵🙏🏽,1673513241
14,financialindependence,[removed],"If you had an extra $4,000 I know it’s not much these days) what would you try to do to make more money from it short term?",1673502867
15,financialindependence,[removed],CASHOUT LOOP (SERVER [DISCORD]) Instant payout,1673499646
16,financialindependence,[removed],How can I improve?,1673490632
17,financialindependence,[removed],Financial Struggles,1673490263
18,financialindependence,[removed],The Opportunity of a Lifetime to Get into The Stock Market is NOW: JHR Q...,1673488184
19,financialindependence,[removed],Advice needed,1673485127
20,financialindependence,[removed],Advice needed,1673482456
21,financialindependence,[removed],How Can I Borrow Mo' Money?,1673478556
22,financialindependence,[removed],In your early 30's would you rather have 4 months off work to travel or $80k?,1673475338
23,financialindependence,[removed],"How to limit your electricity, gas and water usage",1673470820
24,financialindependence,[removed],"How to limit your electricity, gas and water usage",1673470526
25,financialindependence,[removed],You who have already FIREd: are there opportunities to engage with other people where you live?,1673467156
26,financialindependence,[removed],Discover Personal Loans - A Loan for Every Situation,1673462292
27,financialindependence,[removed],LEGAL SHIELD OPPORTUNITY,1673459890
28,financialindependence,"To clarify, I ""failed"" at FIRE because I ended up going back to work almost a year after I pulled the trigger and quit. I consider myself BaristaFIRE because I'm working part-time (80% FTE) for the health insurance benefits and to reach a higher FIRE number. 

Some thoughts now that I've been BaristaFIRE for over a year now (SO remains unemployed, although staying home to care for our twin toddlers is arguably a much harder job than mine where I sit on a computer all day):

* We likely pulled the trigger too early, as we were probably still in leanFIRE territory with lots of big unknown/future expenses (still looking to buy a house, baby #3 on the way, etc) 
* Working from home for 8 hrs/day from Monday thru Thursday has been great for work-life balance, especially since I moved into a lower individual contributor role with no direct reports and hardly any meetings - I have plenty of time to eat breakfast/lunch with our kids, read to them and play with them, and help with cleanup
* With that said, I would still prefer having no job versus a part-time job - I'd like to be a fully present parent for my kids like I was during the time period before I went back to work
* Having a job/salary should hopefully make it easier to get a mortgage, rather than having to try other methods like an asset-based loan, or liquidating a large portion of my taxable brokerage to pay for a house in all cash 
* It's a huge load off my mind to have W2 income for expenses instead of drawing down from our nest egg, i.e. not having to switch from saving mode to spending mode
* Our retirement portfolio is allowed to grow since it remains untouched, which helps to fund regular/chubby FIRE and future/unknown expenses, aka I probably also suffer from One More Year syndrome
* Since I'm still at my high-paying gig, my income allows me the ability to max out my 401k/HSA/IRAs and have enough left over to cover expenses 
* Health insurance costs through my employer are relatively predictable as the premiums, deductible, and OOP Max have remained mostly the same (or with slight increases) over the years
* Our current healthcare coverage is suitable for our needs - we prefer an out-of-state health system which is unfortunately out-of-network for our state's ACA plans
* While this job is great, I know that it won't last forever, so I'm trying to enjoy it as much as I can (I have no problem saying 'no' and for the most part, I can influence my boss to steer work away from my direction, but who knows if/when they'll make a decision to force me to go full time, or my boss leaves and gets replaced by someone really bad, or a reorganization or layoff happens) 
* Before I had kids, I was super ambitious and wanted to climb the corporate ladder as quickly as possible. Now that I have kids, I'm grateful to have a really chill job, but sometimes my pre-kids mentality creeps in and I start thinking about going for those higher roles again. I'm still working through this, but my rational brain knows that now is not the time to add work to my plate, with two toddlers running around and a new baby on the way. If I'm not FIREd by the time they're all school age, then maybe that might be a more appropriate time to start seeking new positions","Failed at FIRE, now currently BaristaFIRE",1673459038
29,financialindependence,[removed],"FIRE = boredom, really?",1673458043
30,financialindependence,[removed],Can someone put you down as a cosigner for a car without your permission?,1673457090
31,financialindependence,[removed],Does RE equal boredom? really.,1673455879
32,financialindependence,[removed],Financially Planning a FIRE Type Sabbatical - Input?,1673455538
33,financialindependence,[removed],sole proprietor mix of traditional &amp; roth 401k,1673451508
34,financialindependence,[removed],Advice on how to appear busy in my wfh role / do minimal work?,1673436204
35,financialindependence,[removed],Advice needed on how to appear busy / do minimal work in my current role? (Tech),1673435684
36,financialindependence,[removed],How did you afford university without parental support?,1673411568
37,financialindependence,[removed],anxiety about finances after college,1673410762
38,financialindependence,[removed],What features would you like to see in an FI app or software?,1673408770
39,financialindependence,[removed],Are 401k contribution limits and Roth IRA limits separate?,1673403136
40,financialindependence,[removed],Migraines,1673400899
41,financialindependence,[removed],How long would it take you to save up 6 months of expenses?,1673397204
42,financialindependence,[removed],Too many or too few ETF’s,1673395932
43,financialindependence,[removed],Awesome Intrinsic Value Calculator - All Financial Statements,1673394558
44,financialindependence,[removed],S&amp;P 500 vs DJIA,1673392602
45,financialindependence,[removed],Path to Financial Independence as a 17 yr old?,1673392049
46,financialindependence,[removed],Path to Financial Independence as a 17 yr old?,1673391553
47,financialindependence,[removed],https://youtu.be/gKqFFPqxGKY,1673391419
48,financialindependence,[removed],Path to Financial Independence as a 17 yr old?,1673391282
49,financialindependence,"Hello!

It seems like question posts are being moved out of the daily thread, so I'm posting this at top level. Let me know if this really does belong in the daily and I'll repost accordingly.

I'm considering whether to contribute to the mega backdoor Roth or, contrary to advice often cited here, send savings beyond my traditional 401K, (backdoor) Roth IRA, and HSA directly to taxable instead. I'm very early in career (age 23, have been working full time for less than a year). I'm totally blind and am pursuing FI in case some potential hearing issues later in life make me unemployable.

While my company offers the mega backdoor Roth (big tech), I imagine that at this stage, much of the value from these early contributions will come from gains rather than principle. I was considering setting up substantially equally periodical payments (SEPP) should I need to retire before age 59.5 and access this account, but this seems disadvantageous from a tax perspective (taxed on earnings and withdrawal at ordinary income rate, as opposed to long-term capital gains on withdrawal from a brokerage). Am I really better off giving up this tax-advantaged space and contributing to a regular brokerage account, assuming pre-59.5 withdrawal? Thanks!",Double taxation on the mega backdoor Roth (is it worth it in my situation?),1673389313
50,financialindependence,[removed],Comparing buying house cash vs mortgage,1673382963
51,financialindependence,[removed],If You Want Money in Visa Card ( United States),1673382504
52,financialindependence,[removed],How have FIRE folks navigated sabbaticals?,1673380204
53,financialindependence,[removed],aplikacja z kodami rabatowymi,1673377186
54,financialindependence,[removed],aplikacja z rabatami,1673377083
55,financialindependence,[removed],payment,1673374826
56,financialindependence,[removed],Will the swiss franc go down in 2023?,1673373583
57,financialindependence,[removed],Thoughts on changing withholding for later this year life events?,1673373236
58,financialindependence,[removed],Advice on Inheritance,1673368925
59,financialindependence,[removed],Any free asset tracker app,1673367952
60,financialindependence,[removed],"Canadian Accepted to American School, need help with student loans",1673365604
61,financialindependence,[removed],AUTOMATED TRADING EXPERIENCE,1673364800
62,financialindependence,[removed],Free expert copywriting for new customers,1673356885
63,financialindependence,[removed],Can blockchain technology be used for doing business or in microfinance?,1673356620
64,financialindependence,[removed],38 years old with $53K in savings account,1673352891
65,financialindependence,[removed],LLC HELP PLEASE,1673349526
66,financialindependence,[removed],Need advice,1673316840
67,financialindependence,[removed],Are Multi Year Guaranteed Annuities really backed by the state Guaranty ??,1673316742
68,financialindependence,"***tl;dr - needed a thoughtful way to let my wife know we spent way too much $ on clothes in 2022, so built*** [a slide deck](https://docs.google.com/presentation/d/1Sf51OaJ0OShKmbj16d0Nec20UimfP6raA4d-td44KXU/edit#slide=id.g1d21173a877_0_0) ***for her. Okay I'm kidding about the clothes part... sort of...***

(We're a 38M / 38F dual-income household with two young kids in a VHCOL area.)

I'm the one that has always kept track of the numbers in our household, and like most in the FI community, I track our NW fairly closely, have us heavy into VTSAX/VTI, etc. My wife has always trusted me to handle our finances and has never really gotten into the weeds with me.

With thoughts and concerns of a rough 2023 swirling in my head, I recently did an analysis of our household spending in 2022, and while I knew our spending had gone up significantly over the last couple years, primarily due to a home purchase and a couple large home improvement projects, I was still taken aback at just how much our other discretionary spending had increased.

While my wife is no spendthrift (she and I have both played equal roles in letting lifestyle creep seep in over the last few years), I needed a way to catch her up and point out the ""opportunity"" before us in a non-confrontational way. Past conversations we'd had around $ hadn't gone particularly well -- I'd pull up our Personal Capital account and start walking her through various charts and graphs, all while espousing the merits of FI, and it was just information overload.

(Side note, I am a huge fan of Personal Capital as an aggregation/NW tracking tool. I've never used their advisory services so can't speak to that.)

So, in an attempt to frame our situation in a more constructive and collaborative way, and per my wife's request (believe it or not), I put some slides together to walk her through an end-of-2022 financial recap for our family. (I'm a mgmt consultant by day, so basically crank slides out for a living.) . Sharing it [here](https://docs.google.com/presentation/d/1Sf51OaJ0OShKmbj16d0Nec20UimfP6raA4d-td44KXU/edit?usp=sharing) in case anyone wants to steal the format. It includes our actual 2022 numbers (let the cries of ""why'd you buy such an expensive house?!?"" begin!)

Anyone else in a situation where your partner takes perhaps a more lackadaisical approach to household finances than you'd like? Curious to know how others have gotten on the same page with their partners without causing friction, as the idea of building a financial slide deck every holiday season isn't all that appealing to me 😅.

We have our finance ""date"" later this week to review the slides together; wish me luck!","Thought we spent too much on clothes in 2022, so built a slide deck for my wife",1673309980
69,financialindependence,"Effectively title. What are some of the more odd-ball side gigs that this community likes to do? Things that aren't the usual landlord, tutor, landscape, dog walker, blogger/book author, etc. I mean weird things like bear trainer, niche writing fields, forest sampler, etc that are ones most people haven't even heard of.",Favorite Off the Beaten Path Side Gigs?,1673305441
70,financialindependence,"I always read advice like ""buy a duplex, live in one, rent the other""... That's at absolute minimum $800k USD in Australia and that's if you're absolutely lucky.

""We bought 10acres of land for pennies and spent $40k on building a house""... In Australia that's pushing close to $1million.

Am I swindled by some sort of bias or does it seem that US folk just have it so much easier when it comes to securing real estate on the path to F.I?",Is real estate in America really that cheap?,1673300443
71,financialindependence,[removed],How to keep track of AGI and MAGI throughout the year?,1673296310
72,financialindependence,"Wife and I are DINKs in a HCOL area and are thinking about buying a house to create housing cost stability as we approach FI. I'd like to share our stats/situation to make sure we aren't making any big mistakes.

* Gross income: $360k
* Expenses: $110K (credit cards paid off monthly)
* Cash: $630k (600k in HYSA earning 3-4%. 30k in checking). We plan to put $500K as a down payment on the house. The remainder will be an E-fund.
* Investments: $900k
   * 401k: $540k in low-cost index funds (90/10 allocation)
   * IRA: $145k in VTSAX
   * Taxable: $145k in VTSAX
   * HSA: $45k in VTSAX
   * Vested RSU: $21k (I usually sell upon vest but keeping some for now as we don't need the money imminently and the stock is way down along w/ everything else.)
   * Bitcoin: $1k (this was a gift. I regret not selling, but just letting it ride since it's a drop in the bucket and theoretically has big upside)

FIRE calculators expect we can FIRE in 4 years if we keep this up. I don't know that we will as I explain below.

Homes that have everything we want in this area go for \~$1M (SFH, safe, good schools, near nature).

If I set my range from 900k-1.1M, I'm looking at a monthly payment of 4k-5k. If both of us keep working, that is tenable. However, if one of us stays home when we have kids, our income gets cut in half, and our housing costs become 33% of our gross income. That's at the very top of the recommended range and makes me feel nervous.

The other factor is I have no idea how to budget for increased child expenses.

I'd like to talk myself into pulling the trigger on building our future dream, but also want a reality check if I'm missing something big here. Appreciate your perspectives.",DINKs in HCOL considering buying a home to start a family...,1673291587
73,financialindependence,[removed],30k investment,1673286169
74,financialindependence,[removed],I'm 16 and want to make money online,1673284937
75,financialindependence,[removed],im 16 and want to make money,1673284882
76,financialindependence,[removed],I'm 16 and want to learn how to make money online,1673284448
77,financialindependence,[removed],Make money online,1673284121
78,financialindependence,Im in my 20s and just entered the healthcare field. I am shocked by how much social security is taxed on my paycheck. Is this normal everywhere? I’m in PA.,Why is social security taxed so high?,1673283896
79,financialindependence,[removed],"If you are young, never pay extra towards your mortgage!",1673282758
80,financialindependence," A recession is a period of economic downturn, typically defined as a decline in GDP (gross domestic product) for two or more consecutive quarters. During a recession, businesses may experience decreased demand for their products or services, leading to layoffs, reduced profits, and other financial challenges. Consumers may also feel the impact of a recession through reduced income, increased unemployment, and a general sense of economic uncertainty. While recessions can be difficult for individuals and organizations, they are a normal part of the economic cycle and are often followed by periods of growth and expansion. 

How to prepare for recession?

 

There are several steps that individuals and organizations can take to prepare for a recession:

1. Build up an emergency fund: Having a financial cushion can help you weather financial setbacks and unexpected expenses. Aim to save enough to cover at least three to six months of living expenses.
2. Reduce debt: Paying off high-interest debt and limiting new borrowing can make you more financially resilient and better able to weather a recession.
3. Diversify your investments: Don't put all your eggs in one basket. A diversified investment portfolio can help mitigate the impact of market downturns.
4. Review your budget: Take a close look at your spending and see where you can cut back. Identifying areas where you can reduce expenses can give you more flexibility if your income is reduced during a recession.
5. Consider building up your skills: During a recession, it may be harder to find a job or get a raise. Consider taking a course or getting additional training to make yourself more marketable and increase your earning potential.
6. Stay informed: Keep an eye on economic indicators and stay informed about potential risks. This can help you make informed decisions about your finances.
7. Seek help if you need it: Don't be afraid to reach out for help if you are struggling financially. There may be resources available to assist you, such as unemployment benefits, financial assistance programs, or counseling services.",How To Stay Financially Fit During A Recession - BICHEP,1673282606
