,subreddit,selftext,title,created_utc
1055,financialindependence,[removed],Finance Base – A Must-Subscribe up-and-coming YouTube Channel For Better Personal Finance,1669185459
1056,financialindependence,[removed],High interest mortgage for high earners,1669169813
1057,financialindependence,[removed],When to switch to 4 days per week,1669168079
1058,financialindependence,[removed],"Is HYLD.TO, DFN.TO, HDIF.TO, SBC.TO reliable for FIRE strategy for 10+ plus year with reinvesting the dividend and monthly contribution. Best these stock prices are keep going down as they are covered call ETFs.",1669166199
1059,financialindependence,[removed],Urgente! 🚨,1669161834
1060,financialindependence,[removed],Need an advice,1669161094
1061,financialindependence,[removed],tweeter,1669160411
1062,financialindependence,"Just as the title states. I'm wondering as to what the differences are. I know that the differences are ""when you are taxed"" but why not just contribute to a traditional IRA when you exceed the income limit vs paying the taxes now to do a backdoor and have a roth? 

Does anyone have any insight? I litterally just passed the income threshold this year and can't contribute to my roth anymore",Backdoor Roth IRA vs Traditional IRA when you make over 144k as a single individual (question),1669159446
1063,financialindependence,[removed],Get chance too win actual money,1669158122
1064,financialindependence,"One of the reasons I seek to FIRE is the simple reason I wish to own more of my time.

Money can be seen as the currency of time. The reason why something costs money is that someone put their time into creating the thing I am buying.  When you spend money, you spend someone else's time they put into serving you. If you are a billionaire, you could spend several lifetimes in a very short amount of time. 

My time is the most important thing I can offer to the world. Be it offering to my friends or family, to work, to enjoyment, or the community. 

This makes our time more precious than we might want to admit. Because the future is inherently unknown, we can never know for sure how much time we have. Do I have 50 years, perhaps only 20?

Who of you has wished you had more time for friends and family? That you could work less and enjoy life more? Some love their work and would do it for free. But a lot of us think they would be happier spending their time in different ways. 

If you look at it this way, every subscription service I pay for, every new car I buy, every time I buy something I don't really need I pay with time I could have used in a more fulfilling way. 

This is why being frugal, saving money, being mindful of how one spends time, and seeking FIRE as a goal is something I strive for, to own my own time. 

Does anyone else think of it this way?",Taking back ownership of your time,1669154798
1065,financialindependence,"Let me start of saying that we are incredibly blessed and we are super grateful to be in this position. We are currently trying to see if we should stop maxing out our 401k to save up to buy our house. Here are some details about us.

* Married
* $250k combined income
* currently live in condo (mortgage is $700 a month)
* currently maxing out our 401k ($3,400 a month)
* have $150k in savings
* Looking to start having kids in the next few years

Because of our really low mortgage we are able to say 70% of our post tax income. Should we stop currently investing and stockpile into savings. I guess the question is should we pay cash for our home or put a 50% - 60% down deposit on our home so our mortgage payment says the same as our current one. We would be looking to spend around $350k to 400k for the home.",Save up to pay cash for house or invest?,1669147157
1066,financialindependence,Hey can anyone help me and tell some ways to make money as a 16 yr old online because I don't want to wait until I am 18 years old to do something.,Ways to make money as a 16 yr old?,1669143667
1067,financialindependence,[removed],This is how I found it,1669142957
1068,financialindependence,[removed],Loan options for investing purposes,1669135176
1069,financialindependence,"I don’t have an IRA nor do I know much about one; here’s what I do know, if this is correct:

° Composed of after-tax income
° Customizable: I would probably do VTSAX
° Maximum annual contribution of $6,500
° Contributions withdrawn tax-free at any age
° Growth withdrawn:
   ° Under 59.5, 5 year account: tax and penalty
   ° Over 59.5: 5 year account: No tax, no penalty
   ° Over 59.5, &lt;5 year account: Tax, no penalty

And for the Vanguard, as far as I know:

° Composed of after-tax income
° VTSAX is my jam for now
° If there’s a contribution limit, it far exceeds what I can put in
° Withdrawn at any point
° Capital gains taxes

Correct me if I’m wrong on either of these

So it seems like the only difference is that the Roth IRA is best used for 59.5+ (which I might not live to see but would build it just in case) due to the lack of penalties, and the Vanguard brokerage is for under 59.5 due to having just a tax, versus tax and a penalty.

Currently:

23 years old
$43,300 in VTSAX
$1,000 in HSA
$1,400 in Trad. 401k (maxed)
$26,000 in liquid cash (Ally 3% HYSA)
$100/week automated into VTSAX",Should I put liquid cash into a Roth IRA or straight into Vanguard?,1669130978
1070,financialindependence,[removed],HSA strategy,1669130669
1071,financialindependence,"Please  use this thread to have discussions which you don't feel warrant a new  post to the sub. While the Rules for posting questions on the basics of  personal finance/investing topics are relaxed a little bit here, the  rules against memes/spam/self-promotion/excessive rudeness/politics  still apply!

Have a look at the [FAQ](https://www.reddit.com/r/financialindependence/wiki/faq) for this subreddit before posting to see if your question is frequently asked. 

Since this post does tend to get busy, consider sorting the comments  by ""new"" (instead of ""best"" or ""top"") to see the newest posts.","Daily FI discussion thread - Tuesday, November 22, 2022",1669111329
1072,financialindependence,[removed],Awesome!,1669102472
1073,financialindependence,"*“How do I make a ton of money”?*

A crass and often scorned question, yet one we’ve all pondered before. Good faith discussions can be hi-jacked by the spiritual (true wealth is internal), nihilistic (be born rich), or political (wealth is evil). These tangents all contain kernels of truth, but they are not actionable. Here are my personal observations, with a bias towards practicality.

First and foremost, the core tenant of making money in a capitalistic society comes down to some iteration of “**provide value to capture value”**. Early in your career, **developing specialized skills** (e.g. medicine, coding, sales, etc.) is a huge force multiplier to your value add. But to reach true fatFIRE levels of wealth, you also needs to figure out how to scale. Whether as an employee or as an entrepreneur, true wealth comes from the ability to **scale your inputs to produce asymmetric outputs**.

What does that mean? How do I scale? Here are three broad (not mutually exclusive, and certainly non-exhaustive) forms of scale that can be applied in one’s career.

# Brand

On the enterprise level, this means **intellectual property**, such as Google’s search algorithm or Pfizer’s patent on the COVID vaccine. It can also mean **literal brands** such as Hermes handbags or Nike shoes. An established brand serves as a moat against competitors from easily entering your market, resulting in higher profit margins for every subsequent product sold. If you work on building your company’s brand / protecting your company’s moat (e.g. software engineer at Google or brand manager at Nike), you will be paid more than those who don’t, even if they work just as hard.

On the individual level, this means developing a rare and valuable skill set to build a **personal brand**, and then leveraging that brand to create value to society. At the highest level, think Joe Rogan for podcasting or Oprah for television, where their eponymous brands provide value to their massive audiences (and subsequently advertisers). But there’s plenty of value to capture in smaller, industry specific niches as well. A KOL in oncology can command huge consulting fees designing clinical trials. A popular author of children’s fiction can generate recurring royalties. A strong brand allows you to decouple your hourly inputs from your monetary outputs and earn at scale.

# Labor

Perhaps the easiest one to understand but the hardest one to properly wield, labor is simply the ability to capture value from other people’s work. If someone creates $100 of value for you, and you pay them $70, then each additional employee you hire represents $30 in value for you (obviously oversimplified). However, why would anyone in a free society agree to let you do this?

One common reason is **apprenticeship**. Whether in medicine, law, or plumbing, marketable skills in many professions must be learned on the job. Less experienced workers willingly trade labor “alpha” for mentorship, often with the idea of paying it forward down the line. An even more common reason is **risk-mitigation**. Take for example a seasoned freelance graphic designer pregnant with her first child. It would be a perfectly rational decision to trade some annual “alpha” for the security of a bi-weekly paycheck and healthcare benefits of a full-time position working for someone else.

In order for you to capture the value of other people’s labor, **you must offer something in return**. Cultivate a rare and valuable skill and learn how to teach it to others. Become an empathetic manager that removes your employees’ professional anxieties (payroll, sick leave, working capital, etc.)  Be cognizant that you are one political revolution away from being eaten by your workers. Yet history has proven being able to successfully manage (or coerce) the labor of others is a proven path for building wealth at scale.

# Capital

On Wall Street, this simply means leverage. Traditional “high finance” (e.g. PE, VC, HF) firms raise capital from limited partners, charge them a fee to deploy said capital, and then share in any potential profits. It is ostensibly no more difficult to manage $10 billion than it is $1 billion, but the associated fees are 10x more. This is scale, in the way of financiers.

But even in “regular” industries, capital plays a huge role in scaling productivity. Start-ups (even cash flow positive ones) regularly take VC money to accelerate their growth. Mature public companies sell stock to raise capital to fund new projects, and issue dividends / buy-back stocks when there are no profitable projects to pursue. Properly deployed\*\*, capital is the lubricant\*\* that facilitates the creation of profitable ventures.

The sarcastic trope of “self-made with a million dollar loan from daddy” has some merit, but the key is to actually know what to do with the capital once you’ve raised it. There is a difference between working capital and disposable income. Understanding the difference determines whether you work for money or money works for you. **Learn to be financially literate**. Doesn’t mean you have to be Gordon Gecko but it’s nearly impossible to get rich without a baseline understanding of how capital markets work.

Thanks for reading.",Maximize Your Career Earnings,1669097478
1074,financialindependence,"Trying to be smarter about putting away for the future. I started a 401k when I got hired withy my current company 3 years ago. I contribute 7% and they offer a 3% match. 

I’m not even contributing a 1/4 of what I’d need to if I wanted to max out the account.

I have a baby and am trying to buy a home next year so it’s not possible at this time to contribute more. How do people do it?!",How do you max out your 401k if (in order to do so) it’s more than half of your gross income?,1669094035
1075,financialindependence,"Know this isn’t a huge deal compared to most in the sub but I’m 22 years old and just got my first real full time job this year. Have been following a lot of advice from you all since graduating in May and have been saving 50% of every paycheck (30% to savings, contributing 20% of salary to a Roth IRA). Now gotta take some of those savings and start investing — have been delaying that until I had a good emergency fund and now is the time to let my money sit somewhere. Just wanted to thank you all for your help along the way, has been instrumental to getting me here.",Hit 25k net worth,1669092908
1076,financialindependence,[removed],Paying yourself through corporation,1669091696
1077,financialindependence,[removed],Graduate Thesis Survey | Work Behaviors &amp; Attitudes (18+ and employed at least part time),1669089523
1078,financialindependence,"I want to highlight a cool volunteer opportunity that I think fits very well with the FIRE community. There is always plenty of discussion here asking how to give back, how to occupy your time after FIRE, and most importantly, how to learn about taxes.

&amp;nbsp;
 
I posted this last year and it received some interest so I wanted to send out another reminder to the community that this program is gearing up again for the next tax season. 

&amp;nbsp;

I'm starting my second year with an agency as a Volunteer Income Tax Assistant (VITA) with a local refugee agency. The program trains you on tax screening so you can provide free tax prep services to people in need. You don't need to have any prior tax experience, they train you on everything. I started last year with very little understanding of how the tax system works (always had someone else file my taxes), and now I've gained deep understanding of the tax code. VITA programs offer an impactful way for people in this community to use their skills and their passion to give back.

&amp;nbsp;

I'm not advocating for a particular program, but if you google VITA in your local area I bet you'll find some programs. A lot of them are even fully virtual. Seems like a great way to help out whether you're FIRE'd or not.

&amp;nbsp;

Cheers!",Give back and get smart on taxes at the same time,1669080880
1079,financialindependence,[removed],i love cars but i want to retire by 40,1669080694
1080,financialindependence,"Any personal stories or people you know who achieved financial independence by investing in private equity? Do share.

I don’t mean as an entrepreneur who sold their business to a private equity firm and had a successful exit. I’m referring to stories of being an LP investor.",Achieving FI by investing in private equity,1669077923
1081,financialindependence,"So, I have just recently bought an investment property using my self-directed Roth IRA LLC. I'm trying to figure out if I am able to lend out the remaining funds from my Roth IRA LLC to another LLC of which I have no association. Basically, lend money to a fixer/flipper and quickly get more money into my Roth in order to buy more property.",Self-Directed Roth IRA question ...,1669075593
1082,financialindependence,Consider you already have a rainy day fund and all your debt was paid off. What would you do with this extra money?,What would you do if you were given $100k in cash tomorrow?,1669074531
1083,financialindependence,[removed],Severance Package Question - has anyone negotiated for severance instead of quitting?,1669074166
1084,financialindependence,"I made some federal student loan payment during 2021 and recently got the “refund”. With the forgiveness still up in the air, I’d like to safely utilize this 25k while waiting for the political drama to settle.

Currently I am taking advantage of Discover’s high yield saving account welcome bonus, which is $200 when 20k is deposited. The 3% APY is not bad. 

I’m looking for better idea/promotion for short term commitment. The money has to stay liquid in case they decide not to forgive any student loan. Depending on the potential reward, I’m willing to risk maximum of 5%.",What would you do if you have $25k laying around?,1669069474
1085,financialindependence,[removed],Earn $390 by inviting friends as well by playing within a few seconds,1669067530
1086,financialindependence,"What are some suggestions for tax advantaged moves to do for our family before year end?  We just had a baby boy.  Here are a few I know of, wanted to get others’ thoughts 

1. Paid out of pocket for medical OBGYN &amp; birth expenses rather than using our HSA fund, so we will deduct these medical expenses from our taxable income.  I also increased HSA during open enrollment to the family amount max.  This will help 2022 taxes, ongoing.  

2. Open 529 and contribute at least to the state level tax credit amount.  For us in IN it’s $1000.  This will help 2022 taxes, ongoing.  

3. Open a dependent care FSA in our open enrollment to the annual max $5k to partially cover daycare expenses.  This will help 2023 taxes, ongoing.  

Any others?",Tax advantaged moves for parents,1669067403
1087,financialindependence,"Suppose you're semi-fi and looking for a lower impact job to help sustain you. What are some tips/tricks to get such a job? Things like:

* Do you really really tone back your resume to hide how over-qualified you are?
* Are you honest with prospective employers about why you're looking to ""downgrade""? Or what reasoning do you give?


For context, I am an unemployed software developer who is 'grey-area-fi'. (To me, calculating exactly when I can personally become financially independent has been difficult. But I am probably fi.. probably.. The current market doesn't help though.)

I've been unemployed for about 7 months, and it hasn't really been going that well to be honest. It seems like I may need some structure in my life to stay active. Thus, I am looking to go back to work but probably to something low-key, so to speak. 

BTW, I'm hoping to hear from people who've actually done this or are in the process rather than just those who are speculating.",What are the tips/tricks for getting a job you're overqualified for? (for semi-fi/barista-fi),1669066760
1088,financialindependence,"I'm a 24 y/o software developer, salary of £150k after taxes. I have decided to dedicate my 20s to honing my craft in the field of tech with future aspirations of starting and growing a tech business along the same lines to a respectable turnover so that I can get on the road to financial freedom. My life goals are those that you'd expect from (a relatively) young man whose ambitious (nice car, nice family and wife, house etc.). To me, financial freedom has always been the objective.

I have always had the mindset that I cannot enjoy life until I have made or created something substantial and respectable for myself (a moralistic view of life). Holidays, parties, concerts etc have been a form of mental derailment at least according to my philosophy. I have set extremely high standards for myself and severely punish myself for underperformance. This form of imposter syndrome has actually benefited me as my ideal is a state of perfection but it has its shortcomings as my life is severely unbalanced.

My question however is can those who are truly high achieving have a balanced life that takes career, relationships, health, etc., all into consideration (optimally) whilst not compromising on either one? Do high achieving people have to accept that there is a sacrifice that is to be made a priori, and that life satisfaction runs contradictory to their fundamental axioms?",How to find life satisfaction whilst searching for financial freedom?,1669060189
1089,financialindependence,"Hello. Just looking for ideas on what career to pivot into moving forward.

The only real debt I have is $13K in student loans which I’m hoping Biden can get forgiven but I’m
not counting on it of course.

I have no mortgage. Rent and utilities with a partner is about $750/month.

Car is paid off.

No credit card debt because I don’t roll that way.

I have an 800 credit score.

Not married and plan to never have children.

The only thing is my income right now is low. Like $17.50/hr which I can live on and still save a little money every month.

I’d say my biggest expense put of necessities is just food. I love my damn food. Otherwise my hobbies are simple: reading, drawing and watching TV.

I don’t travel and don’t have expensive tastes/hobbies.

I’m looking to do a second career change into something with higher pay, good job security and options for side gigs in the industry or seasonal work.

I like the work hard for a chunk of time then relax for extended periods of time kind of lifestyle.

I’m considering Expat COAST Fire if I can manage my finances right.

I want to avoid getting into too much debt for extra schooling since I’m not keen on jumping into more loans when I’m so close to being debt free.

I was looking at things like coding (though with all the lay offs I’m not sure how secure it is) + I’m not very good at it.

I know there are boot camps for it.

Realistically I’m looking at nursing, but that would require going back to school. I can do it the cheap way but that would still take me about 3 years probably if not more.

Someone on here also recommended journeyman. Trades etc.

I’d like to hear from you guys for ideas. My goal is to ultimately expat fire, but expat coast fire sounds cool too and lowers the bar for me by a lot.

TL;DR: almost debt free. How can I increase income via new career while minimizing debt/loans",Nearly debt free. How can I increase my income with minimal debt/investment? 29F,1669054130
1090,financialindependence,"So I just hit 6 figures of savings, not accounting for my retirement funds, that I would like to keep relatively liquid. Right now it is making very minimal interest with a large bank, but I want to move most of it into a high yield savings account. The issue that I'm seeing is that there are transfer limits of 15-20k per month, so how would I go about a) depositing \~75k into this account and b) withdrawing it when I need to? Most of the high interest accounts are in institutions that aren't physically in my area, so I can't just go get a cashier's check from them. I plan on keeping my current checking account, as that is where all of my auto-payments and deposits go to...don't want to go through the hassle of changing everything in that regard. I would like to make my cash work for me in a savings account but I'm not sure how it would work logistically.",How do I utilize high interest savings account with capped transfer limits?,1669047336
1091,financialindependence,[removed],Follow me here bbs,1669045673
1092,financialindependence,"I’m 22, graduated college about 1 year ago, and am planning to continue my masters program next year. I have ~$30,000 in loans just from my undergrad. I don’t have any other significant debts.

I have a full time job making ~$28,000/year. I’m very fortunate to be in a position where I don’t have any real recurring expenses/bills other than things like food, toiletries, etc.

At the end of the month I’ll gain access to a 401K through my work. I’m not sure the details of the account. I’m just wondering what my best option is here. Put as much money into the 401K as possible, pay the student loans off asap, save my money into a personal regular savings account? Just want to do what will benefit me most in the future. Wondering if I should just expect and accept that student loans are a bill I’ll have until I die, and just pay as little as possible forever.",Should I even try to pay off my student loans?,1669038274
1093,financialindependence,"Please  use this thread to have discussions which you don't feel warrant a new  post to the sub. While the Rules for posting questions on the basics of  personal finance/investing topics are relaxed a little bit here, the  rules against memes/spam/self-promotion/excessive rudeness/politics  still apply!

Have a look at the [FAQ](https://www.reddit.com/r/financialindependence/wiki/faq) for this subreddit before posting to see if your question is frequently asked. 

Since this post does tend to get busy, consider sorting the comments  by ""new"" (instead of ""best"" or ""top"") to see the newest posts.","Daily FI discussion thread - Monday, November 21, 2022",1669024929
1094,financialindependence," 

Need help applying broader FIRE principles to your own situation? We’re here for you!

Post  your detailed personal “case study” and ask as many questions as you  like, or help others who’ve done the same. Not sure if your questions  pertain? Post them anyway…you might be surprised.

It’ll  be helpful to use our suggested format. Simply copy/paste/fill in/etc.  But since everybody’s situation is different, feel free to tailor your  layout to your needs.

\-Introduce yourself

\-Age / Industry / Location

\-General goals

\-Target FIRE Age / Amount / Withdrawal Rate / Location

\-Educational background and plans

\-Career situation and plans

\-Current and future income breakdown, including one-time events

\-Budget breakdown

\-Asset breakdown, including home, cars, etc.

\-Debt breakdown

\-Health concerns

\-Family: current situation / future plans / special needs / elderly parents

\-Other info

\-Questions?","Weekly “Help Me FIRE!” thread. Post your detailed information for highly specific advice - November 21, 2022",1669024869
