,subreddit,selftext,title,created_utc
593,financialindependence,"Please  use this thread to have discussions which you don't feel warrant a new  post to the sub. While the Rules for posting questions on the basics of  personal finance/investing topics are relaxed a little bit here, the  rules against memes/spam/self-promotion/excessive rudeness/politics  still apply!

Have a look at the [FAQ](https://www.reddit.com/r/financialindependence/wiki/faq) for this subreddit before posting to see if your question is frequently asked. 

Since this post does tend to get busy, consider sorting the comments  by ""new"" (instead of ""best"" or ""top"") to see the newest posts.","Daily FI discussion thread - Tuesday, December 20, 2022",1671530529
594,financialindependence,"19 and have saved up $10k, what should i start doing to become financially free?

As the title states i am young and have saved a decent amount of money for my age. i have built a small following on youtube making music and i make ~$700 a month from this. i also work a job from home with a salary of around 30k a year. over the last year i have saved around 10k and by reading rich dad poor dad and watching 100s of videos on youtube about finance i know i can’t just sit on this money and that i have to do something with it. i have been making small steps that are easily done towards improving my financial situation. for example, i just got my first credit card and i have been making purchases with it, i have also been very conscious of living below my means. i have some marketing and branding experience from growing my music persona and have alright video editing and photoshop skills. i have messed around with dropshipping a bit and i feel like i could find success in this field but if there’s anything else i should change or do that would be wiser than essentially throwing money at a wall and hoping it works, please let me know.","19 and have saved up $10k, what should i start doing to become financially free?",1671524807
595,financialindependence,[removed],i think i may have summary of think and grow rich chapter 1 &amp; 2,1671524094
596,financialindependence,"My question is kinda… vague. I want to educate myself with as much knowledge about managing my money and how to efficiently make more money, know what kinds of risks to take. I’m looking for a book or book series I can read (that’s not like a fricking school text book unless that’s my only option) that’s able to be understood. I’d say I’m beginner to learning this.
I don’t want to go to school for this, that’s a waste of money and so boring, I can learn everything I need from home and books.",Is there a book series I can read to get a basic understanding on finances?,1671521100
597,financialindependence,[removed],My dad has worked his Ass off his whole life just to still be broke,1671500588
598,financialindependence,"When you achieve a milestone?  That gets you closer to a better phase in your life financially (getting a job with much higher salary)? 

I mean people who are in your close circle - family, relatives, and friends. Like SOME did not acknowledge it, like nothing ever happened. But that progress means much to you.",What could be the reasons why people don't congratulate you?,1671497855
599,financialindependence,"I’m just curious one what resource(s) you’d recommend to read up on for the barista FIRE method. I’ve always thought about it, but didn’t know it had a name for it - so I’m new to really learning about the intricacies. 

We’re mid-thirties, debt free including mortgage, and could basically retire in just shy of ten years. We both have debated about switching to consulting part time, and I have hobbies that could make a couple ten grand or so a year. As an American, it’s really decent health insurance that stands in our way of departing our career trajectory. Thanks!",Best resources on Barista FIRE,1671494680
600,financialindependence,"Why does MMM get hated on now? I don't really get it. He's what led me to FI and all this stuff, but it seems like a lot of people hate him now. I never seem to get a clear reason though other than putting ads on his site, but every blog has that so that can't be all. 

I still like his message of environmentalism, consuming less and being positive about life. Why don't you like him?",Why do people on here hate Mr Money Mustache now?,1671482616
601,financialindependence,[removed],Register and get iPhone 14 Pro Max Free!!,1671477454
602,financialindependence,[removed],Venta de productos 😶‍🌫️,1671474780
603,financialindependence,"bought bti at 194 back in november cpi report day, went up to 204.5 but didnt sell because i didnt know anything about cpi reports and the upcoming downturn of the market in 2023. Now its at 191.5 and i lost about 10k.

i thought about selling so i can buy the upcoming dip in 2023, but i really want vti to go back to at least 194 so i can very least get my original investment back, but  if dont sell, if the 2023 dip comes i will be losing a huge opportunity.

i basically went all in on vti so i dont have any cash reserves. I listened to these pros saying staying in the market is better than timing the market......how does that example even benefit me here? I dont get why ppl say that when the market is going down. I having all your cash ready is the best thing to do so you can buy them all at the lowest price. 

wtf????",IM TRAPPED...AM I SCREWED?,1671473246
604,financialindependence,[removed],401k advice,1671470899
605,financialindependence,[removed],Anyone FIRE'd in Portugal with under €25K yearly,1671458767
606,financialindependence,[removed],Trading bots,1671454006
607,financialindependence," 

Need help applying broader FIRE principles to your own situation? We’re here for you!

Post  your detailed personal “case study” and ask as many questions as you  like, or help others who’ve done the same. Not sure if your questions  pertain? Post them anyway…you might be surprised.

It’ll  be helpful to use our suggested format. Simply copy/paste/fill in/etc.  But since everybody’s situation is different, feel free to tailor your  layout to your needs.

\-Introduce yourself

\-Age / Industry / Location

\-General goals

\-Target FIRE Age / Amount / Withdrawal Rate / Location

\-Educational background and plans

\-Career situation and plans

\-Current and future income breakdown, including one-time events

\-Budget breakdown

\-Asset breakdown, including home, cars, etc.

\-Debt breakdown

\-Health concerns

\-Family: current situation / future plans / special needs / elderly parents

\-Other info

\-Questions?","Weekly “Help Me FIRE!” thread. Post your detailed information for highly specific advice - December 19, 2022",1671444069
608,financialindependence," Please  use this thread to post your milestones, humblebrags and status updates  which you don't feel warrant a new post to the sub. While the Rules for  posting questions on the basics of personal finance/investing topics  are relaxed a little bit here, the rules against  memes/spam/self-promotion/excessive rudeness/politics still apply!

Since this post does tend to get busy, consider sorting the comments  by ""new"" (instead of ""best"" or ""top"") to see the newest posts.","Weekly FI Monday Milestone thread - December 19, 2022",1671444011
609,financialindependence,[removed],Should I buy a single family home?,1671427020
610,financialindependence,"I am currently living abroad, so I don't have to pay federal taxes on my income due to the Foreign Earned Income Exclusion. I have around $50,000 in a pretax account that I could roll over into a post-tax account. I would have to pay Delaware state income taxes on it (around 3%). Does it make sense to pay the 3% and roll it over now? My instinct is yes, but I'm not sure if I'm missing someone.",Does it make sense to do a Roth IRA rollover if I will only pay state taxes?,1671426914
611,financialindependence,[removed],FIRE as an accidental result of schizoid PD family?,1671424766
612,financialindependence,"First off I'm very unsure of how Reddit works so sorry I'm advance if I shouldn't be posting here

Little context, neither I nor her know jack shit about advanced finances or mortgage aside from the basic info.

But I did notice she has 733 for a credit score which is beautiful for a 21 year old, and if I had to guess her yearly income it'd be about 50k a year on the light side, more likely around 65.

But anyway the question I wanna ask is; is it a good idea to look into getting a mortgage now while her credit score is highest? I know being under 25 is probably a demerit, but if that's all I don't see why not. Unless active years is a deal breaker, then I'd get it...

Just a heads up since I'm sure it's relevant but couldn't find a place to squeeze it in, we're in Queens, NY, where even a regular house would easily sell for 1m+ and a 1 bedroom rental would average 16-1800 if you're lucky~",Should my friend look into Mortgages at 21?,1671423151
613,financialindependence,[removed],1099-k form on,1671418170
614,financialindependence,[removed],ZkSync gift Airdrop,1671402965
615,financialindependence," 

I've heard in the past that it's not smart to borrow money or take out a loan and invest it into the Stock Market.

In the past I would take out $10,000-$20,000 loans that ran for \~5 years at an interest rate anywhere from 7%-9%.

Yes I know that ultimately I shouldn't be doing that. Fortunately I got really lucky and placed them into very good blue chip companies before deciding to just withdraw it all and then just dump everything into an S&amp;P500 index fund.

There is another interesting thing about this strategy that I wanted to point out. That even though the interest rates were high at 7%-9%, and the loans were for about 5 years, I would pay them all off within less than a year like anywhere from 6months-8months. So I didn't have to pay much interest on the loan due to paying it off so quickly. My goal was to simply take a large lump sum and quickly put it all into the market. Basically ""time in the market"" &gt;&gt;&gt; all else. It would have taken me considerably longer to wait to accumulate $20,000 with my bi-weekly pay checks.

For future reference I don't plan to do this anymore, but I would like to hear people's thoughts on this?",Opinions on borrowing money to invest in the stock market?,1671392606
616,financialindependence,[removed],Lele Gold Coin Game,1671391997
617,financialindependence,[removed],Seeking advice regarding obtaining new rental home,1671386675
618,financialindependence,"Rough numbers in my area here. There  is a river community in the town south of me. Granbury, TX (Brazos river) lots are selling for under $20,000 for 5-10,000 sq ft. A new singlewide around 1,000 sq ft goes for about $80,000. I figure add about $20,000 in extras (tax, driveway, septic, real estate fees) and you’ve got a home that should sell for $150.000-175,000. That’s $30,000-55,000 in profit. Does this sound like a good investment? I know right now is not the best time to get into real estate, but are things really going to get better in my lifetime?","Is there money to be made buying property, setting up a mobile home then selling it?",1671378568
619,financialindependence,"Hey everyone. I'm in the military and my retirement account is all robo-invested and intend to retire out of the military so I'm set.

But my wife doesn't have anything and I want to help her get set up. I want something that's simple to use/invest and not eat too much of my time (like my TSP, put money in. It goes to the right place).

Would anyone have any recommendations on companies to use to get a 401k/Roth account? I don't want to be doing monthly trading or anything like that.

I'm also really nervous we're (she) is severely behind on this but I'm sure we can get back on top of this?",wife (29) doesn't have a retirement accountand I don't know how to help her start!,1671377030
620,financialindependence,[removed],"24 yo, parents recently died, inherited some cash and estates, need advices about my future plan",1671368494
621,financialindependence,"Please  use this thread to have discussions which you don't feel warrant a new  post to the sub. While the Rules for posting questions on the basics of  personal finance/investing topics are relaxed a little bit here, the  rules against memes/spam/self-promotion/excessive rudeness/politics  still apply!

Have a look at the [FAQ](https://www.reddit.com/r/financialindependence/wiki/faq) for this subreddit before posting to see if your question is frequently asked. 

Since this post does tend to get busy, consider sorting the comments  by ""new"" (instead of ""best"" or ""top"") to see the newest posts.","Daily FI discussion thread - Sunday, December 18, 2022",1671357729
622,financialindependence,"30M. Perpetually single and seems to be the life story. While ignoring that fact, what moves can I make with my money to succeed in that economy that is based around two incomes, essentially for someone who doesn’t want to work forever. I figure if I’m single, I atleast can not work a lot and travel of be with friends and family. Just bought a house in med/high cola in California. Got a good interest rate and price, currently have a roommate paying approximately 25% of housing costs. Have around 100k saved and will be building another unit on my lot hopefully this year. Which will decrease my housing cost to less then 1000$ /month. I’m currently working 2 jobs making about $160k but am planning to quit my second job this year an will be reduced to about 90k/year. I have no debts or loans. I have minimal retirement accounts at the moment and am 7 years in with a government pension. What should I do to plan for this? Also, my main job I negotiated a good amount of vacation currently 4 weeks a year and will be raising to 5 weeks next year.",Any money moves for someone who is eternally single?,1671357176
623,financialindependence,[removed],New ZkSync Airdrop,1671354927
624,financialindependence,"The buy now pay later. I’m super skeptical about things like this, tough times right now for groceries and a family member uses this and recommended it to me.  I’ve been reading up on it but just looking for more opinions!",What is y’all’s opinions on Sezzle?,1671349697
625,financialindependence,"Working on a script to basically check if my investments will last me through retirement with random monthly stock prices and random yearly inflation rates. I've been using the [Rich, Broke, or Dead](https://engaging-data.com/will-money-last-retire-early/) tool to check my results. I'm getting \~70% success rate while this site is giving me 98% with 3% withdraw rate. I have expenses increase annually with COLA through CPI-W. The website talks about the trinity study, and how everyone thinks a 4% withdraw rate is basically guaranteed to work. I'm wondering if expenses increasing over time is taken into account, or if they're using inflation-adjusted stock returns or not.",Does the Trinity Study account for inflation?,1671343403
626,financialindependence,"The title states it all. I just had a present-less bday on the 12th again - I have zero family that helps and I'm at a place where I need a lawyer to get my huge back pay and disability

What's more important is the 20-30 dollar things I need. It's not alot, how do I achieve these things? Trust me, I live in some not fun darkness and feel like an absolute failure because I can never work again and I just have an abusive family who refuses to remember anything they did to us kids. We all moved out by 15 for a reason. 6+ years on the street, then on a nursing home after being hit by a car and coma for 29 days and sustained a moderate to severe TBI with one eye thanks to third nerve palsy from impact. Just lost it's 5 days after my birthday and IM STILL TRYING as hard as I can to obtain a natural product that helps my flashbacks and panic attacks. My best friend from the nursing home who was my dad's age and a great lawyer before her tragedy died last month so yeah. This is all new to me.",how can a 33 year old who's disabled in assisted living obtain means to buy small things needed for himself,1671324495
627,financialindependence,[removed],Is edward jones ripping off my relative?,1671321715
628,financialindependence,"I started on my FIRE journey back in the 2010s when I graduated law school.  $200k in student loan debt, soul-crushing job, no way out.  FIRE was really what helped me feel more in control of my life.  I started a side hustle e-commerce business and started riding my bike everywhere.  Eventually I felt secure enough to leave my first job and switch to a better job, even though it was a paycut.

Between 2018-2021, I kept the better job and started carefully building a more purposeful life.  I bought some cheap land and built an affordable home that I love.  The lack of financial and career stress has allowed me to be more social, so I feel like I have a more well-rounded life too.

So, to the point.  In late 2021 a friend of mine (someone I met due to my nicer job!) approached me and asked if I'd be interested in joining her personal injury law firm.  I was skeptical b/c it feels a bit scummy to be a personal injury attorney, it just has a stigma.  But my friend explained that if I came on board I'd get a % of every case I win.  That cuts both ways; if I don't win, I don't make any money.

I figured why not give it a try?  I have a ton of savings, so if it didn't work out I could just go get a normal job again.

Well, after a year of this job, it looks like I'll have made about $350k in 2022, and I am working remotely.  It's an awesome job.  Before this, the most I've ever made in a year is $110k.  This is an astounding amount of money to me, and I could possibly barista FIRE now if I wanted to.  I would never have taken this job if not for the position FIRE put me in.  

A lot of FIRE commentary focuses on the end goal (the workless utopia), but grabbing the reins of your own life has a lot of other benefits.  Stay the course.",How FIRE Helped Me Supercharge My Career,1671321376
629,financialindependence,[removed],Quick money,1671313988
630,financialindependence,[removed],"6 Best Work From Home Jobs! (Netflix Tagger, Amazon Product Tester ect.)",1671313711
631,financialindependence,[removed],Airdrop from zkSync,1671313390
632,financialindependence,[removed],should we sell our home to pay off student loans?,1671312564
633,financialindependence,[removed],"6 Best Work From Home Jobs! (Netflix Tagger, Amazon Product Tester ect.)",1671309595
634,financialindependence,[removed],"6 Best Work From Home Jobs! (Netflix Tagger, Amazon Product Tester ect.)",1671306871
635,financialindependence,"I've been married for a couple years (both 29 years old) . Let's just say my wife is more of a spender than a saver. She doesn't want to be frugal to the point where we can't enjoy the present (go on an international vacation once a year, eating out at a fancy place once a month, give each other gifts, give our infant the best food/toys, going shopping, etc.). How do you deal with differences in philosophy on saving vs spending? For the record I've saved 250k in retirement so far with a income of 120k/year. My wife isn't working yet but will be joining medical residency in a year and a half. Is she right? Are we in a good position to enjoy the present, let the current savings do the work, cut back our retirement contributions for now, and ramp up our savings rate once she starts working?","Marrying someone who wants to live in the present, doesn't agree with FIRE?",1671305378
636,financialindependence,[removed],Who Else is taking an early Barista Fi Approach?,1671302926
637,financialindependence,[removed],New airdrop from ZkSync,1671294837
638,financialindependence,[removed],ZkSync gift Airdrop,1671284284
639,financialindependence,[removed],The Fastest Possible Way To Live Off Dividends,1671283471
640,financialindependence,[removed],Any YouTube channel or learning website to learn concepts of CFA level 1?,1671278622
641,financialindependence,I got a call from a debt collector right before  the six year mark while it still was active arkansas statue of limitations is 6 years. I agreed to pay 600 of 2000 as a settlement so they wouldn't Sue me I was stupid I gave them my card number they said they would wait until a certain time to pull out 300 then 300 the next time I get paid this was extremely dumb because I realized they could probably pull out whatever they want so I immediately called My bank and told them to cancel my card.  Even though I agreed I don't know if they pulled anything my guess I said I was so broke till the day I get paid they were gonna pull as much as they can that day but I will never know because I canceled it they said it would be automanic I'm wanting to settle it for 600 if possible compared to getting sued but the thing is if I just ignored it it probably wouldn't have Then been collectible But I read online because I agreed to make a payment they were probably recording and that resets the statute of limitations So I pretty much completely screwed myself over Because if I would have waited I'm guessing I would have not been responsible,agreed to payment not made at statue of limitations over phone?,1671278416
642,financialindependence,[removed],firecalc.com Adjust Spending Level for Success Rate Strange Results,1671271511
643,financialindependence,"Please  use this thread to have discussions which you don't feel warrant a new  post to the sub. While the Rules for posting questions on the basics of  personal finance/investing topics are relaxed a little bit here, the  rules against memes/spam/self-promotion/excessive rudeness/politics  still apply!

Have a look at the [FAQ](https://www.reddit.com/r/financialindependence/wiki/faq) for this subreddit before posting to see if your question is frequently asked. 

Since this post does tend to get busy, consider sorting the comments  by ""new"" (instead of ""best"" or ""top"") to see the newest posts.","Daily FI discussion thread - Saturday, December 17, 2022",1671271329
644,financialindependence,[removed],hi need some advice,1671257220
645,financialindependence,"So I had a check for $1000 and deposited it today

I check later and the deposit is only
For $100?  Is this easy to fix?? I don’t have the receipt. And I’m sure the Receipt only says $100 too?

Is it easy for them to find the check? Or do I have to ask the person who paid me to send me
Another $900? Kinda annoying",Can’t find a place to ask this. My bank deposited wrong,1671254437
646,financialindependence,[removed],Why is there very few people(top 1%) that wants to achieve Financially Freedom Retire Early?,1671252330
647,financialindependence,[removed],My FIRE videos Playlist,1671250398
648,financialindependence,"40F financially independent for the last ten years, no longer need to work. Took a few years off explored hobbies, started working again part time because I was feeling out of touch with people. It's the little things, easily paying the bill for a shared meal, or just aware that I'm actually not sleep deprived. Friendships develop and inevitably I end up sharing that I don't need to work (maybe I just over share lol) people usually tend to distance themselves from me, adding to the out of touch feeling. It's a subtle resignation, amazement then sadness I'm assuming because I have what they want. How to handle this so that I'm less lonely?",How to Handle Jealousy?,1671247979
649,financialindependence,[removed],Get a Car Title Loan From LoanMart Right Now! What is loan?,1671242322
650,financialindependence,[removed],BHK Financial,1671237449
651,financialindependence,[removed],"EOY Re-balancing, fixing asset placement, getting out of a robo-advisor, all while avoiding the taxman",1671236697
652,financialindependence,"Recently my wife and I became mortgage free, it felt absolutely amazing making that final payment and a goal achieved after about 7 years. We've never taken out a normal loan so never had debts outside the mortgage  

On personal level, I worked hard to make it happen and in hindsight there were many hard days at work but this goal in the distance kept me going.

We both agreed not to tell anyone, not even family. I'd personally would love to tell my dad though as he hasn't been well and I feel he would be proud. 

And finally, oddly I have a strange feeling - I've had a very bad week at work and have a voice in my head saying ""run away - travel abroad"" and rent the paid off house. I would get more than enough to live a decent life. 

If I use my intelligence, it says stay in my high stress job and keep saving, invest in more property or stocks. I won't rush into anything but in an odd way achieving the dream has made me lose focus in the past couple of weeks. 

But anyways, feels good to confess what I've been unable to tell anyone in real life

Thanks for reading",Mortgage and debt free at 33,1671224763
